{
  "id": "evc_radio_distress",
  "name_zh": "求救信号",
  "start_event_id": "evt_broadcast_distress",
  "nodes": [
    {
      "event_id": "evt_broadcast_distress",
      "when": {
        "days_offset": 0,
        "hour": 22
      },
      "skippable": false
    },
    {
      "event_id": "evt_decision_trader_visit",
      "when": {
        "days_offset": 1,
        "hour": 18
      },
      "skippable": true
    },
    {
      "event_id": "evt_broadcast_military",
      "when": {
        "days_offset": 3,
        "hour": 22
      },
      "skippable": true
    }
  ],
  "endings": [
    {
      "condition": {
        "op": "flag_has",
        "flag": "trader_visit_seen",
        "value": true
      },
      "ending_kind": "resolved"
    },
    {
      "condition": {
        "op": "flag_has",
        "flag": "distress_heard",
        "value": true
      },
      "ending_kind": "open_thread"
    },
    {
      "condition": {
        "op": "city_pressure",
        "pressure_min": 70.0
      },
      "ending_kind": "tragedy"
    }
  ],
  "tags": [
    "broadcast",
    "distress",
    "radio"
  ]
}