{
  "id": "evc_water_crisis",
  "name_zh": "七日水危机",
  "start_event_id": "evt_d3_water_warning",
  "nodes": [
    {
      "event_id": "evt_d3_water_warning",
      "when": {"days_offset": 0, "hour": 10},
      "skippable": false
    },
    {
      "event_id": "evt_park_water_run",
      "when": {"days_offset": 1, "hour": 9},
      "skippable": true
    },
    {
      "event_id": "evt_radio_rumour",
      "when": {"days_offset": 2, "hour": 21},
      "skippable": true
    }
  ],
  "endings": [
    {
      "condition": {"op": "flag_has", "flag": "water_run_done", "value": true},
      "ending_kind": "resolved"
    },
    {
      "condition": {"op": "city_pressure", "pressure_min": 70.0},
      "ending_kind": "tragedy"
    },
    {
      "condition": {"op": "flag_has", "flag": "water_warning_seen", "value": true},
      "ending_kind": "open_thread"
    }
  ],
  "tags": ["supply", "week1", "water"]
}