{
  "id": "evc_new_recruit",
  "name_zh": "新幸存者加入",
  "start_event_id": "evt_decision_wounded_stranger",
  "nodes": [
    {
      "event_id": "evt_decision_wounded_stranger",
      "when": {
        "days_offset": 0,
        "hour": 12
      },
      "skippable": false
    },
    {
      "event_id": "evt_d5_stranger_visit",
      "when": {
        "days_offset": 2,
        "hour": 10
      },
      "skippable": true
    },
    {
      "event_id": "evt_decision_refugee_group",
      "when": {
        "days_offset": 4,
        "hour": 11
      },
      "skippable": true
    }
  ],
  "endings": [
    {
      "condition": {
        "op": "flag_has",
        "flag": "stranger_visit_logged",
        "value": true
      },
      "ending_kind": "resolved"
    },
    {
      "condition": {
        "op": "flag_has",
        "flag": "refugees_seen",
        "value": true
      },
      "ending_kind": "open_thread"
    },
    {
      "condition": {
        "op": "city_pressure",
        "pressure_min": 70.0
      },
      "ending_kind": "tragedy"
    }
  ],
  "tags": [
    "social",
    "recruit"
  ]
}