{
  "id": "evc_water_supply",
  "name_zh": "缺水危机",
  "start_event_id": "evt_chain_node_water_2",
  "nodes": [
    {
      "event_id": "evt_d3_water_warning",
      "when": {
        "days_offset": 0,
        "hour": 9
      },
      "skippable": false
    },
    {
      "event_id": "evt_chain_node_water_2",
      "when": {
        "days_offset": 2,
        "hour": 10
      },
      "skippable": true
    },
    {
      "event_id": "evt_park_water_run",
      "when": {
        "days_offset": 3,
        "hour": 8
      },
      "skippable": true
    }
  ],
  "endings": [
    {
      "condition": {
        "op": "flag_has",
        "flag": "water_run_done",
        "value": true
      },
      "ending_kind": "resolved"
    },
    {
      "condition": {
        "op": "city_pressure",
        "pressure_min": 70.0
      },
      "ending_kind": "tragedy"
    },
    {
      "condition": {
        "op": "flag_has",
        "flag": "water_node_2_seen",
        "value": true
      },
      "ending_kind": "open_thread"
    }
  ],
  "tags": [
    "supply",
    "water"
  ]
}