{
  "id": "evc_migration_pressure",
  "name_zh": "迁徙压力",
  "start_event_id": "evt_decision_refugee_group",
  "nodes": [
    {
      "event_id": "evt_decision_refugee_group",
      "when": {
        "days_offset": 0,
        "hour": 13
      },
      "skippable": false
    },
    {
      "event_id": "evt_decision_escape_plan",
      "when": {
        "days_offset": 2,
        "hour": 9
      },
      "skippable": true
    },
    {
      "event_id": "evt_broadcast_military",
      "when": {
        "days_offset": 3,
        "hour": 18
      },
      "skippable": true
    },
    {
      "event_id": "evt_decision_late_patrol",
      "when": {
        "days_offset": 4,
        "hour": 21
      },
      "skippable": true
    }
  ],
  "endings": [
    {
      "condition": {
        "op": "flag_has",
        "flag": "evacuation_prepared",
        "value": true
      },
      "ending_kind": "resolved"
    },
    {
      "condition": {
        "op": "city_pressure",
        "pressure_min": 80.0
      },
      "ending_kind": "tragedy"
    },
    {
      "condition": {
        "op": "flag_has",
        "flag": "escape_plan_seen",
        "value": true
      },
      "ending_kind": "open_thread"
    }
  ],
  "tags": [
    "social",
    "migration"
  ]
}