{
  "id": "evc_disease_outbreak",
  "name_zh": "疾病爆发",
  "start_event_id": "evt_chain_node_disease_1",
  "nodes": [
    {
      "event_id": "evt_chain_node_disease_1",
      "when": {
        "days_offset": 0,
        "hour": 8
      },
      "skippable": false
    },
    {
      "event_id": "evt_decision_medical_stock",
      "when": {
        "days_offset": 2,
        "hour": 9
      },
      "skippable": true
    },
    {
      "event_id": "evt_broadcast_quarantine",
      "when": {
        "days_offset": 4,
        "hour": 10
      },
      "skippable": true
    }
  ],
  "endings": [
    {
      "condition": {
        "op": "flag_has",
        "flag": "disease_chain_started",
        "value": true
      },
      "ending_kind": "resolved"
    },
    {
      "condition": {
        "op": "city_pressure",
        "pressure_min": 78.0
      },
      "ending_kind": "tragedy"
    },
    {
      "condition": {
        "op": "flag_has",
        "flag": "medical_chain_started",
        "value": true
      },
      "ending_kind": "open_thread"
    }
  ],
  "tags": [
    "medical",
    "disease"
  ]
}