{
  "id": "evc_intro_welcome",
  "name_zh": "初到基地",
  "start_event_id": "evt_first_night_decision",
  "nodes": [
    {
      "event_id": "evt_first_night_decision",
      "when": {"days_offset": 0, "hour": 22},
      "skippable": false
    },
    {
      "event_id": "evt_d2_rumour_watch",
      "when": {"days_offset": 1, "hour": 9},
      "skippable": true
    },
    {
      "event_id": "evt_d2_rumour_exhaustion",
      "when": {"days_offset": 1, "hour": 9},
      "skippable": true
    }
  ],
  "endings": [
    {
      "condition": {"op": "flag_has", "flag": "watch_rotation_locked", "value": true},
      "ending_kind": "resolved"
    },
    {
      "condition": {"op": "flag_has", "flag": "first_night_decision_logged", "value": true},
      "ending_kind": "abandoned"
    },
    {
      "condition": {"op": "city_pressure", "pressure_min": 70.0},
      "ending_kind": "tragedy"
    },
    {
      "condition": {"op": "flag_has", "flag": "first_night_decision_logged", "value": true},
      "ending_kind": "open_thread"
    }
  ],
  "tags": ["intro", "morale"]
}